"Advertiser Name","Advertiser URL","MID","Advertiser Description","Link to T&C","Link to Program History","Link to Home Page","Status","Contact Name","Contact Title","State","City","Address","Zip","Country","Phone","Email Address","Commission Terms","Offer","Offer Type","Year Joined","Expiration Date","Return Days","Transaction Update Window","TrueLock","Premium Status","Baseline Commission Terms","Baseline Offer","Baseline Offer Type","Baseline Expiration Date","Baseline Return Days","Baseline Transaction Update Window","Baseline TrueLock"
"4imprint Inc.","http://www.4imprint.com","35298","4imprint provides businesses and organizations with innovative promotional merchandise, imprinted promotional products and customized gifts. 4imprint offers customers unparalleled efficiency, significant cost-savings and a 360 degree service guarantee.","http://cli.linksynergy.com/cli/publisher/common/agreement.php?file=35298_20131218_150035.txt","http://cli.linksynergy.com/cli/publisher/programs/advertiser_detail.php?mid=35298&nid=1&offerhistory=1&controls=1:1:3","http://click.linksynergy.com/fs-bin/click?id=V8uMkWlCTes&offerid=331099&type=3&subid=0","Active","Jim Simone","VP of Business Development","Wisconsin","Oshkosh","101 commerce street ","54901","US","9202367272 ext 8116","jsimone@4imprint.com","1.00% commission on all goods","23.1","% of Sale","2014"," 31-DEC-15","30","90","N","N/A","1.00% commission on all goods","23.1","% of Sale"," 31-DEC-15","30","90","N",
"A4C","http://www.a4c.com","36160","A4C is your one stop 
shop for all your cell phone accessories. 
A4C matches quality product with 
unbeatable prices, a popular combination 
with today's web-savvy consumers.","http://cli.linksynergy.com/cli/publisher/common/agreement.php?file=agreement.txt","http://cli.linksynergy.com/cli/publisher/programs/advertiser_detail.php?mid=36160&nid=1&offerhistory=1&controls=1:1:3","http://click.linksynergy.com/fs-bin/click?id=V8uMkWlCTes&offerid=303249&type=3&subid=0","Active","Aron Brown","Director of Marketing","New York","Brooklyn","320 7th Avenue 260","11213","US","8779994235","aron@all4cellular.com","6.00% commission on all goods","19.1","% of Sale","2013"," 31-DEC-18","30","90","N","N/A","6.00% commission on all goods","19.1","% of Sale"," 31-DEC-18","30","90","N",
"AHAlife.com","http://www.ahalife.com/","37615","AHAlife offers 2000+ artisan brands, from traditional to avant-garde. Discover inspiring stories and objects from around the world in home décor, jewelry, beauty, electronics and more. Shop for gifts that enhance lives and protect creativity. ","http://cli.linksynergy.com/cli/publisher/common/agreement.php?file=37615_260289_2.txt","http://cli.linksynergy.com/cli/publisher/programs/advertiser_detail.php?mid=37615&nid=1&offerhistory=1&controls=1:1:3","http://click.linksynergy.com/fs-bin/click?id=V8uMkWlCTes&offerid=260289&type=3&subid=0","Active","Mitchell Steinberg","Director of Marketing","New York","New York","45 BOND ST ","11237","US","1-646-454-1110","mitchell@ahalife.com","7.00% commission on all goods","4.2","% of Sale","2013"," 02-APR-16","15","90","N","N/A","7.00% commission on all goods","4.2","% of Sale"," 02-APR-16","15","90","N",
"Air Filters Delivered","http://www.airfiltersdelivered.com/","38746","Air Filters Delivered has the Best Price in the Industry for HVAC Air Filters, Furnace Filter Replacements, Electrostatic Filters, Washable Filters and disposable air filters.","http://cli.linksynergy.com/cli/publisher/common/agreement.php?file=agreement.txt","http://cli.linksynergy.com/cli/publisher/programs/advertiser_detail.php?mid=38746&nid=1&offerhistory=1&controls=1:1:3","http://click.linksynergy.com/fs-bin/click?id=V8uMkWlCTes&offerid=301708&type=3&subid=0","Active","Affiliate Manager","Affiliate Manager","Florida","Orlando","4157 Seaboard Rd ","32808","US","(407) 298-5733","emarketing@conairindustries.com","8.00% commission on all goods","3.1","% of Sale","2014"," 05-AUG-15","30","90","N","N/A","8.00% commission on all goods","3.1","% of Sale"," 05-AUG-15","30","90","N",
"Allurez","http://www.Allurez.com","36401","Allurez is the premier online jewelry store for high quality fine jewelry, designer jewelry, engagement rings, bridal jewelry, and certified loose diamonds. Our high quality marketing material, and constant support, will lead to higher conversions.","http://cli.linksynergy.com/cli/publisher/common/agreement.php?file=36401_213049.txt","http://cli.linksynergy.com/cli/publisher/programs/advertiser_detail.php?mid=36401&nid=1&offerhistory=1&controls=1:1:3","http://click.linksynergy.com/fs-bin/click?id=V8uMkWlCTes&offerid=213049&type=3&subid=0","Active","John","Affiliate Marketing Director ","New York","new york","36 w 47th st ","10036","US","6463127718","partners@allurez.com","private |8.00% commission on all goods","4.1","% of Sale","2013"," 03-NOV-15","30","90","N","N/A","8.00% commission on all goods","3.1","% of Sale"," 04-OCT-15","30","90","N",
"American National Standards Institute Inc.","http://webstore.ansi.org","36327","ANSI's affiliate program will do best on sites that offer books, software, training, industrial supplies, consulting services and standards related programs such as ISO 9000, quality management, ISO 14000, safety and also a variety of other topics. 

","http://cli.linksynergy.com/cli/publisher/common/agreement.php?file=agreement.txt","http://cli.linksynergy.com/cli/publisher/programs/advertiser_detail.php?mid=36327&nid=1&offerhistory=1&controls=1:1:3","http://click.linksynergy.com/fs-bin/click?id=V8uMkWlCTes&offerid=215094&type=3&subid=0","Active","Tyesha Thomas","Sr. Product Manager","New York","New York","25 West 43 Street, 4FL ","10036","US","212-642-4989","tthomas@ansi.org","private |10.00% commission on all goods","5.1","% of Sale","2013"," 01-DEC-15","45","90","N","N/A","10.00% commission on all goods","2.3","% of Sale"," 01-NOV-15","45","90","N",
"Approved Colleges","http://www.approvedcolleges.com/","39384","Approved Colleges is a premier provider of online education resources, courses, degree programs and skill assessment tests with one of the web's largest catalogs of higher education data serving both businesses and consumers.","http://cli.linksynergy.com/cli/publisher/common/agreement.php?file=39384_20140401_202157.txt","http://cli.linksynergy.com/cli/publisher/programs/advertiser_detail.php?mid=39384&nid=1&offerhistory=1&controls=1:1:3","http://click.linksynergy.com/fs-bin/click?id=V8uMkWlCTes&offerid=331362&type=3&subid=0","Active","Ryan Frazier","Director of Marketing","Virginia","Harrisonburg","4080 Buck Run Ct ","22802","US","561-339-5091","Rfrazier@Approvedcolleges.com","private |20.00% commission on all goods","4.1","% of Sale","2014"," 08-APR-15","60","90","N","N/A","20.00% commission on all goods","3.1","% of Sale"," 10-FEB-16","60","90","N",
"Auto Detailing Supplies Inc.","http://www.smartwax.com/","38914","Based in Southern California, Chemical Guys i sa manufacturer specializing in the highest quality car care chemicals, car wash accessories, buffing pads and machines. Chemical Guys is more than a brand - it's a lifestyle with a worldwide following.","http://cli.linksynergy.com/cli/publisher/common/agreement.php?file=agreement.txt","http://cli.linksynergy.com/cli/publisher/programs/advertiser_detail.php?mid=38914&nid=1&offerhistory=1&controls=1:1:3","http://click.linksynergy.com/fs-bin/click?id=V8uMkWlCTes&offerid=314361&type=3&subid=0","Active","Mike Scharnagl","VP, Marketing","California","Inglewood","3915 102 St ","90303","US","310-674-8135","mike@smartwax.com","private |2.00%-6.00% commission on all goods","4.1","% of Sale","2013"," 31-DEC-18","7","90","N","N/A","2.00%-6.00% commission on all goods","3.1","% of Sale"," 05-NOV-18","7","90","N",
"Auto Parts Warehouse","http://www.AutoPartsWarehouse.com","35207","Earn as much as 14% COMMISSION and take advantage of regional brand awareness when you co-promote the Auto Parts Warehouse on your site. We offer discount auto parts and accessories and have the largest on-line inventories.","http://cli.linksynergy.com/cli/publisher/common/agreement.php?file=35207_320843.txt","http://cli.linksynergy.com/cli/publisher/programs/advertiser_detail.php?mid=35207&nid=1&offerhistory=1&controls=1:1:3","http://click.linksynergy.com/fs-bin/click?id=V8uMkWlCTes&offerid=320843&type=3&subid=0","Active","Abigail Santiago","Affiliate Program Manager","California","Carson","16941 Keegan Avenue ","90746","US","(760) 849-4365","asantiago@usautoparts.com","private |8.00% commission on all goods; [private |8.00% commission on selected goods,; private |10.00% commission on selected goods,; private |14.00% commission on selected goods]; ","67.1","% of Sale","2014"," 10-FEB-16","45","90","N","N/A","8.00% commission on all goods; [8.00% commission on selected goods,; 10.00% commission on selected goods,; 14.00% commission on selected goods]; ","5.380","% of Sale"," 05-NOV-15","45","90","N",
"Automotix","http://www.automotix.com/","37578","Automotix, with over 40 million parts available online, is an aggregator of various automotive stores, importers, distributors, dealers, suppliers, wholesalers, re-manufacturers & automotive service providers.   Consumers can find any auto part they need.","http://cli.linksynergy.com/cli/publisher/common/agreement.php?file=agreement.txt","http://cli.linksynergy.com/cli/publisher/programs/advertiser_detail.php?mid=37578&nid=1&offerhistory=1&controls=1:1:3","http://click.linksynergy.com/fs-bin/click?id=V8uMkWlCTes&offerid=257723&type=3&subid=0","Active","Andrew Morgans","Affiliate Manager","Missouri","Pleasant Valley","8608 Brenda Lane ","64068","US","816-447-8963","andrew@automotix.org","private |5.00% commission on all goods","5.1","% of Sale","2013"," 29-MAY-17","60","90","N","N/A","5.00% commission on all goods","3.1","% of Sale"," 18-MAY-17","60","90","N",
"B2C Jewels","http://www.b2cjewels.com","35490","B2C Jewels is a fast-growing online store of fine diamond jewelry and trendy products in gold, pearl & gemstone. Offering free shipping, 30-day returns, and huge discounts guarantee maximum customer come-back. We ship internationally! ","http://cli.linksynergy.com/cli/publisher/common/agreement.php?file=35490_359484.txt","http://cli.linksynergy.com/cli/publisher/programs/advertiser_detail.php?mid=35490&nid=1&offerhistory=1&controls=1:1:3","http://click.linksynergy.com/fs-bin/click?id=V8uMkWlCTes&offerid=359484&type=3&subid=0","Active","B2C Jewels Affiliate Team","B2C Jewels Affiliate Team","New York","New York","16 W 46th St. Suite 902","10036","US","1-866-522-2539","affiliates@b2cjewels.com","7.00% commission on all goods; [3.00% commission on selected goods,; 3.00% commission on selected goods,; 1.00% commission on selected goods,; $15.00 flat fee on selected goods,; $30.00 flat fee on selected goods,; $50.00 flat fee on selected goods,; $100.00 flat fee on selected goods,; $200.00 flat fee on selected goods,; $15.00 flat fee on selected goods,; $30.00 flat fee on selected goods,; $50.00 flat fee on selected goods,; $100.00 flat fee on selected goods,; $200.00 flat fee on selected goods]; ","724.1","% of Sale","2013"," 31-DEC-15","90","90","N","N/A","7.00% commission on all goods; [3.00% commission on selected goods,; 3.00% commission on selected goods,; 1.00% commission on selected goods,; $15.00 flat fee on selected goods,; $30.00 flat fee on selected goods,; $50.00 flat fee on selected goods,; $100.00 flat fee on selected goods,; $200.00 flat fee on selected goods,; $15.00 flat fee on selected goods,; $30.00 flat fee on selected goods,; $50.00 flat fee on selected goods,; $100.00 flat fee on selected goods,; $200.00 flat fee on selected goods]; ","724.1","% of Sale"," 31-DEC-15","90","90","N",
"Beauty Brands","http://www.beautybrands.com/","39516","Beauty Brands is a revolutionary concept in the beauty industry: the first retail company to combine a full-service salon and spa within a dynamic retail superstore.  ","http://cli.linksynergy.com/cli/publisher/common/agreement.php?file=agreement.txt","http://cli.linksynergy.com/cli/publisher/programs/advertiser_detail.php?mid=39516&nid=1&offerhistory=1&controls=1:1:3","http://click.linksynergy.com/fs-bin/click?id=V8uMkWlCTes&offerid=342769&type=3&subid=0","Active","Sara Meyer","Director of eCommerce","Kansas","Lenexa","15507 West 99th Street ","66219","US","1-877-640-2248","affiliates@beautybrands.com","private |7.00% commission on all goods","4.1","% of Sale","2015"," 10-JUL-16","30","90","N","N/A","7.00% commission on all goods","3.1","% of Sale"," 07-JUL-16","30","90","N",
"Beauty Encounter","http://www.beautyencounter.com","37349","Beauty Encounter offers discounted prices on all things beauty: fragrances, cosmetics, skincare, hair care, and beauty accessories. We specialize in hard-to-find and discontinued products.","http://cli.linksynergy.com/cli/publisher/common/agreement.php?file=37349_265419.txt","http://cli.linksynergy.com/cli/publisher/programs/advertiser_detail.php?mid=37349&nid=1&offerhistory=1&controls=1:1:3","http://click.linksynergy.com/fs-bin/click?id=V8uMkWlCTes&offerid=265419&type=3&subid=0","Active","Anne Souvannaseng","Director of Marketing","California","Fountain Valley","18480 Pacific Street ","92708","US","714-698-0820 x 8021","affiliate@beautyencounter.com","private |6.00% commission on all goods","11.1","% of Sale","2013"," 31-DEC-15","7","90","N","N/A","6.00% commission on all goods","10.1","% of Sale"," 30-AUG-15","7","90","N",
"Beauty.com","http://www.beauty.com","3002","Beauty.com is a leading online destination for prestige beauty products. The web store provides a highly personalized shopping experience and offers more than 250 brands ranging from widely recognized to niche, hard-to-find products.","http://cli.linksynergy.com/cli/publisher/common/agreement.php?file=3002_298790.txt","http://cli.linksynergy.com/cli/publisher/programs/advertiser_detail.php?mid=3002&nid=1&offerhistory=1&controls=1:1:3","http://click.linksynergy.com/fs-bin/click?id=V8uMkWlCTes&offerid=298790&type=3&subid=0","Active","Mike Winand","Strategic Account Manager","Washington","Bellevue","411 108th Ave. NE Suite 1600","98004","US","(425) 372-3200","ls-beauty@linkshare.com","8.00% commission on all goods; [ on selected goods,; 0.00% commission on selected goods]; ","684.1","% of Sale","2012"," 30-JUN-15","20","90","N","Premium","8.00% commission on all goods; [ on selected goods,; 0.00% commission on selected goods]; ","860.1","% of Sale"," 01-JAN-16","1","90","N",
"Beckett Media","http://www.beckett.com/","39357","Beckett has been a leader in the collectibles industry since its start in 1984. We are the world?s most trusted source in collecting and a leading online destination for sports collectibles enthusiasts. . ","http://cli.linksynergy.com/cli/publisher/common/agreement.php?file=agreement.txt","http://cli.linksynergy.com/cli/publisher/programs/advertiser_detail.php?mid=39357&nid=1&offerhistory=1&controls=1:1:3","http://click.linksynergy.com/fs-bin/click?id=V8uMkWlCTes&offerid=341911&type=3&subid=0","Active","Nashim Akhtar","Marketing Manager","Texas","Dallas","4635 McEwen Road ","75244","US","2392802300","affiliate@beckett.com","private |5.00% commission on all goods","5.1","% of Sale","2014"," 19-DEC-15","14","90","N","N/A","5.00% commission on all goods","4.1","% of Sale"," 16-APR-15","14","90","N",
"Bedford Fair","http://bedfordfair.blair.com/","38665","Shop for comfortable women's clothing and shoes with Bedford Fair at affordable prices. Clothing available in misses, petite, and women sizes. ","http://cli.linksynergy.com/cli/publisher/common/agreement.php?file=38665_301561_2.txt","http://cli.linksynergy.com/cli/publisher/programs/advertiser_detail.php?mid=38665&nid=1&offerhistory=1&controls=1:1:3","http://click.linksynergy.com/fs-bin/click?id=V8uMkWlCTes&offerid=301561&type=3&subid=0","Active","Chris Park","Marketing Manager","Arizona","Tucson","7840 East Broadway Blvd. Suite 220","85710","US","520-745-4500","ls-bedfordfair@linkshare.com","5.00% commission on all goods; [0.00% commission on selected goods]; ","7.2","% of Sale","2014"," 11-MAY-15","10","90","N","N/A","5.00% commission on all goods; [0.00% commission on selected goods]; ","7.2","% of Sale"," 11-MAY-15","10","90","N",
"Best Buy Co, Inc.","http://www.bestbuy.com","38606","Best Buy is the #1 retailer and most trafficked website for consumer electronics.  You can always count on Best Buy for fantastic customer service and competitive prices on the best electronics, entertainment and appliance products.","http://cli.linksynergy.com/cli/publisher/common/agreement.php?file=38606_355974.txt","http://cli.linksynergy.com/cli/publisher/programs/advertiser_detail.php?mid=38606&nid=1&offerhistory=1&controls=1:1:3","http://click.linksynergy.com/fs-bin/click?id=V8uMkWlCTes&offerid=355974&type=3&subid=0","Active","Best Buy Affiliate Team","Account Team","Minnesota","Richfield","7601 Penn Avenue South ","55423","US","(612) 291-1000","Ls-bestbuy@linkshare.com","1.00% commission on all goods; [0.00% commission on selected goods,; 1.00% commission on selected goods,; 2.00% commission on selected goods,; 2.50% commission on selected goods,; 3.00% commission on selected goods,; 4.00% commission on selected goods,; 5.00% commission on selected goods,; 6.00% commission on selected goods,; $10.00 flat fee on selected goods,; $25.00 flat fee on selected goods]; ","230.19","% of Sale","2014"," 03-NOV-15","1","90","N","N/A","1.00% commission on all goods; [0.00% commission on selected goods,; 1.00% commission on selected goods,; 2.00% commission on selected goods,; 2.50% commission on selected goods,; 3.00% commission on selected goods,; 4.00% commission on selected goods,; 5.00% commission on selected goods,; 6.00% commission on selected goods,; $10.00 flat fee on selected goods,; $25.00 flat fee on selected goods]; ","230.19","% of Sale"," 03-NOV-15","1","90","N",
"Blair","http://www.blair.com/","38770","Women?s, men?s and home styles that fit you and your budget.","http://cli.linksynergy.com/cli/publisher/common/agreement.php?file=38770_20130916_212615.txt","http://cli.linksynergy.com/cli/publisher/programs/advertiser_detail.php?mid=38770&nid=1&offerhistory=1&controls=1:1:3","http://click.linksynergy.com/fs-bin/click?id=V8uMkWlCTes&offerid=308080&type=3&subid=0","Active","Chris Park","Affiliate/Partnership Manager","Arizona","Tucson","7840 East Broadway Blvd. ","85710","US","814-723-3600 x6074","cjpark@blair.com","9.50% commission on all goods; [0.00% commission on selected goods]; ","3.1","% of Sale","2014"," 31-DEC-19","30","90","N","N/A","9.50% commission on all goods; [0.00% commission on selected goods]; ","3.1","% of Sale"," 31-DEC-19","30","90","N",
"BookPal","http://www.book-pal.com/","39470","BookPal features over 3 million titles in bulk, specializing in orders of 25+ copies per title. We provide affordable bulk books to schools, corporations, nonprofits and government institutions while ensuring exceptional customer service.","http://cli.linksynergy.com/cli/publisher/common/agreement.php?file=39470_335996.txt","http://cli.linksynergy.com/cli/publisher/programs/advertiser_detail.php?mid=39470&nid=1&offerhistory=1&controls=1:1:3","http://click.linksynergy.com/fs-bin/click?id=V8uMkWlCTes&offerid=335996&type=3&subid=0","Active","Meghan Falk","Account Manager","California","Irvine","18101 Von Karman Ave Suite 120","92612","US","866-522-6657 x 245","Meghan@book-pal.com","private |5.00% commission on all goods; [private |0.00% commission on selected goods]; ","5.1","% of Sale","2014"," 13-MAY-15","60","90","N","N/A","5.00% commission on all goods; [0.00% commission on selected goods]; ","3.1","% of Sale"," 12-MAY-15","60","90","N",
"Boyles Brand Central","www.boyles.com","39858","Since 1949 Boyles Furniture & Rugs has been providing the finest home furnishings to the worlds most discerning clients.","http://cli.linksynergy.com/cli/publisher/common/agreement.php?file=39858_20141112_200629.txt","http://cli.linksynergy.com/cli/publisher/programs/advertiser_detail.php?mid=39858&nid=1&offerhistory=1&controls=1:1:3","http://click.linksynergy.com/fs-bin/click?id=V8uMkWlCTes&offerid=364524&type=3&subid=0","Active","Rich Barker","PPC Manager","North Carolina","Charlotte","207 Regency Executive Park Dr Suite 150 ","28217","US","9803220518","rich.barker@webfullcircle.com","private |9.00% commission on all goods","4.1","% of Sale","2015"," 31-DEC-15","30","90","N","N/A","9.00% commission on all goods","3.1","% of Sale"," 04-JUN-15","30","90","N",
"Budo Videos","http://www.budovideos.com/shop/customer/home.php","38695","Budovideos is a premiere supplier of martial arts\MMA apparel and gear.","http://cli.linksynergy.com/cli/publisher/common/agreement.php?file=38695_300914_2.txt","http://cli.linksynergy.com/cli/publisher/programs/advertiser_detail.php?mid=38695&nid=1&offerhistory=1&controls=1:1:3","http://click.linksynergy.com/fs-bin/click?id=V8uMkWlCTes&offerid=300914&type=3&subid=0","Active","Affiliate Manager","Affiliate Manager","Texas","Garden Grove","7495 Anaconda Ave ","92841","US","4075190507","affiliates@budovideos.com","10.00% commission on all goods","5.2","% of Sale","2014"," 31-DEC-18","30","90","N","N/A","10.00% commission on all goods","5.2","% of Sale"," 31-DEC-18","30","90","N",
"Buy.com (dba Rakuten.com Shopping)","http://www.rakuten.com/","36342","We are a leading retailer focused on providing a positive shopping experience &  competitive prices and free shipping for over 12 million products. ","http://cli.linksynergy.com/cli/publisher/common/agreement.php?file=36342_353438.txt","http://cli.linksynergy.com/cli/publisher/programs/advertiser_detail.php?mid=36342&nid=1&offerhistory=1&controls=1:1:3","http://click.linksynergy.com/fs-bin/click?id=V8uMkWlCTes&offerid=353438&type=3&subid=0","Active","Marianne Ng","Marketing Specialist","California","Aliso Viejo","85 Enterprise Suite 100","92656","US","(800) 800-0800","ls-buyus@linkshare.com","0.50%-2.00% commission on all goods; [0.00%-0.50% commission on selected goods,; 1.00%-3.00% commission on selected goods,; 0.00% commission on selected goods,; 0.00% commission on selected goods]; ","1036.8","% of Sale","2012"," 09-OCT-15","14","90","N","Premium","0.50%-2.00% commission on all goods; [0.00%-0.50% commission on selected goods,; 1.00%-3.00% commission on selected goods,; 0.00% commission on selected goods,; 0.00% commission on selected goods]; ","1036.8","% of Sale"," 09-OCT-15","14","90","N",
"CWD","http://www.cwdlimited.com","36429","By choosing to become a publisher for CWD, you have at your disposal quality name brand products, competitive and low pricing all year around in addition to product catalogs with an average order value of $324.00 and Conversion Rate of 3.5%- 5%.","http://cli.linksynergy.com/cli/publisher/common/agreement.php?file=agreement.txt","http://cli.linksynergy.com/cli/publisher/programs/advertiser_detail.php?mid=36429&nid=1&offerhistory=1&controls=1:1:3","http://click.linksynergy.com/fs-bin/click?id=V8uMkWlCTes&offerid=369859&type=3&subid=0","Active","CWD Affiliate Team","Affiliate Marketing Coordinator","New York","Cheektowaga","60 Industrial Parkway Suite #Z64 Suite #Z64","14227","US","905-353-1331","rachel@directagents.com","8.00% commission on all goods","28.1","% of Sale","2012"," 17-FEB-20","15","90","N","N/A","8.00% commission on all goods","28.1","% of Sale"," 17-FEB-20","15","90","N",
"Canadapetcare","www.canadapetcare.com","39866","CanadaPetCare.com is a trusted supplier of top quality pet supplies for dogs and cats at heavily discounted prices. We supply genuine brand name products like Frontline Plus, Comfortis, Heartgard, Revolution, Trifexis, K9 Advantix & Program Plus.","http://cli.linksynergy.com/cli/publisher/common/agreement.php?file=agreement.txt","http://cli.linksynergy.com/cli/publisher/programs/advertiser_detail.php?mid=39866&nid=1&offerhistory=1&controls=1:1:3","http://click.linksynergy.com/fs-bin/click?id=V8uMkWlCTes&offerid=356074&type=3&subid=0","Active","Andy","Mr.","Surrey","hasselemere","102 High Street ","GU27 2LA","GB","1-800-982-1308","info@vertiforge.com","private |10.00% commission on all goods","4.1","% of Sale","2014"," 02-SEP-15","30","90","N","N/A","10.00% commission on all goods","2.2","% of Sale"," 13-JUL-15","30","90","N",
"Cascio Interstate Music","http://www.interstatemusic.com","24572","Cascio Interstate Music offers over 60,000 top brand music and consumer electronics products, including Drum Sets, Guitars, Amps, Keyboards, Recording Gear, Live Sound, Home Audio, Televisiona, Cameras, Tablets, Software, Game Consoles and iGear.","http://cli.linksynergy.com/cli/publisher/common/agreement.php?file=24572_272227.txt","http://cli.linksynergy.com/cli/publisher/programs/advertiser_detail.php?mid=24572&nid=1&offerhistory=1&controls=1:1:3","http://click.linksynergy.com/fs-bin/click?id=V8uMkWlCTes&offerid=272227&type=3&subid=0","Active","Elizabeth Dylewski","Program Manager","Wisconsin","New Berlin","13819 W National Ave ","53151","US","2624395812","edylewski@interstatemusic.com","private |6.00%-8.00% commission on all goods","16.1","% of Sale","2013"," 08-NOV-15","30","90","N","N/A","6.00%-8.00% commission on all goods","4.2","% of Sale"," 31-DEC-15","30","90","N",
