"fye.com","http://www.fye.com","24416","f.y.e is your entertainment source for hundreds of thousands of DVD?s, Blu Rays, music CD's, and electronic games for the whole family. We even have used CD's and DVD's where consumers can SAVE! Check out our coupons, discounts, and seasonal offers.","http://cli.linksynergy.com/cli/publisher/common/agreement.php?file=agreement.txt","http://cli.linksynergy.com/cli/publisher/programs/advertiser_detail.php?mid=24416&nid=1&offerhistory=1&controls=1:1:3","http://click.linksynergy.com/fs-bin/click?id=V8uMkWlCTes&offerid=134398&type=3&subid=0","Active","fye.com","Affiliate Marketing Manager","New York","Albany","38 Corporate Circle ","12203","US","8474967810","mgunn@profitrank.com","private |5.00% commission on all goods","6.1","% of Sale","2013"," 27-SEP-16","10","90","N","N/A","5.00% commission on all goods","4.5","% of Sale"," 20-NOV-16","10","90","N",
"jollychic.com","http://www.jollychic.com/","39137","Jollychic.com sells thousands of  popular garment brands at reasonable prices.","http://cli.linksynergy.com/cli/publisher/common/agreement.php?file=39137_20131213_073251.txt","http://cli.linksynergy.com/cli/publisher/programs/advertiser_detail.php?mid=39137&nid=1&offerhistory=1&controls=1:1:3","http://click.linksynergy.com/fs-bin/click?id=V8uMkWlCTes&offerid=317070&type=3&subid=0","Active","Jolly Affiliate","Affiliate Manager","Zhejiang","Hangzhou","702#Gudun Road, West Lake District, ","310010","CN","86-571-88355579","service@jollyaffiliate.com","15.00% commission on all goods","2.1","% of Sale","2014"," 01-JAN-16","45","90","N","N/A","15.00% commission on all goods","2.1","% of Sale"," 01-JAN-16","45","90","N",
"photoweavers.com","http://www.photoweavers.com/","37974","Welcome to Photoweavers, when you care about quality! Photo Blankets - the gift that will be remembered forever.  Order direct from the factory and save. We weave photo blankets, pillows, tote bags, 
and wall hangings. ","http://cli.linksynergy.com/cli/publisher/common/agreement.php?file=agreement.txt","http://cli.linksynergy.com/cli/publisher/programs/advertiser_detail.php?mid=37974&nid=1&offerhistory=1&controls=1:1:3","http://click.linksynergy.com/fs-bin/click?id=V8uMkWlCTes&offerid=280421&type=3&subid=0","Active","Dennis Hasley","Business Development","North Carolina","Columbus","504 East Mills Street ","28722","US","319-461-1815","dennis@photoweavers.com","private |8.00% commission on all goods","5.1","% of Sale","2013"," 31-DEC-18","15","90","N","N/A","8.00% commission on all goods","4.1","% of Sale"," 31-DEC-18","15","90","N",
"refrigiwear.co","http://www.refrigiwear.com/","40068","Since 1954 RefrigiWear has been providing outerwear, footwear, gloves and hats for extreme cold working conditions. In 2014 we expanded to fashion outerwear following the same quality and excellence that sustains our main lines.","http://cli.linksynergy.com/cli/publisher/common/agreement.php?file=40068_368324.txt","http://cli.linksynergy.com/cli/publisher/programs/advertiser_detail.php?mid=40068&nid=1&offerhistory=1&controls=1:1:3","http://click.linksynergy.com/fs-bin/click?id=V8uMkWlCTes&offerid=368324&type=3&subid=0","Active","Mike Henderson","Interactive Marketing Manager","Georgia","Dahlonega","54 Breakstone Dr ","30533","US","8006453744","mhenderson@refrigiwear.com","private |10.00% commission on all goods","7.1","% of Sale","2015"," 31-DEC-15","15","90","N","N/A","10.00% commission on all goods","4.2","% of Sale"," 31-DEC-15","15","90","N",
"{*}1ink.com","http://1ink.com/","37535","1Ink.com a leader in online ink products has been in business over 12 years & is ready to pay you 28% commission on ANY purchase! FREE shipping on orders over $55 & a satisfaction guarantee ensures your consumers ink purchases will be the right one!","http://cli.linksynergy.com/cli/publisher/common/agreement.php?file=37535_256774_2.txt","http://cli.linksynergy.com/cli/publisher/programs/advertiser_detail.php?mid=37535&nid=1&offerhistory=1&controls=1:1:3","http://click.linksynergy.com/fs-bin/click?id=V8uMkWlCTes&offerid=256774&type=3&subid=0","Hold","Raymond Davoudikia","1ink Affiliate Manager","California","Burbank","2850 N. California St. Suite 110","91504","US","8666588125","ray@1ink.com","private |28.00% commission on all goods","4.2","% of Sale","2013"," 03-DEC-17","90","90","N","N/A","28.00% commission on all goods","3.4","% of Sale"," 04-DEC-17","90","90","N",
"{*}6ks.com","http://www.6ks.com/","38153","6ks.com is your trusted source for fashionable women's clothing. With a large selection in stock, our products are available in various styles and colors. Competitive prices, superior customer service and fast delivery are guaranteed. ","http://cli.linksynergy.com/cli/publisher/common/agreement.php?file=agreement.txt","http://cli.linksynergy.com/cli/publisher/programs/advertiser_detail.php?mid=38153&nid=1&offerhistory=1&controls=1:1:3","http://click.linksynergy.com/fs-bin/click?id=V8uMkWlCTes&offerid=289311&type=3&subid=0","Hold","Viven Chen","Marketer","N","Hong Kong","UNIT04?71F BRIGHT WAY TOWER NO.33 MONG KOK RD KL ","999077","HK","00852-27935511","6ksfashion@gmail.com","private |10.00% commission on all goods","8.1","% of Sale","2013"," 13-MAY-15","20","90","N","N/A","10.00% commission/$1.00 flat fee on all goods","15.1","Flat Fee, % of Sale"," 06-MAY-15","30","90","N",
"{*}AndOtherBrands.com","http://www.andotherbrands.com/","38556","And Other Brands brings you three iconic British brands in one click. Shop Oasis, Warehouse, or Coast's beautiful collections today.","http://cli.linksynergy.com/cli/publisher/common/agreement.php?file=agreement.txt","http://cli.linksynergy.com/cli/publisher/programs/advertiser_detail.php?mid=38556&nid=1&offerhistory=1&controls=1:1:3","http://click.linksynergy.com/fs-bin/click?id=V8uMkWlCTes&offerid=298528&type=3&subid=0","Hold","Andrea Bergshoef","International Ecommerce Manager","New York","New York","740 Broadway, Suite 701 ","10003","US","00442032177870","andrea.bergshoef@warehouse.co.uk","private |7.00% commission on all goods","3.1","% of Sale","2014"," 31-DEC-18","30","90","N","N/A","private |7.00% commission on all goods","3.1","% of Sale"," 31-DEC-18","30","90","N",
"{*}Beautorium.com","http://www.beautorium.com","35150","Introducing Beautorium.....we take the guesswork out of going green! Join the growing green revolution and team up with Beautorium, featuring a carefully edited collection of the world's most effective and ethical natural and organic beauty brands.","http://cli.linksynergy.com/cli/publisher/common/agreement.php?file=35150_162746_4.txt","http://cli.linksynergy.com/cli/publisher/programs/advertiser_detail.php?mid=35150&nid=1&offerhistory=1&controls=1:1:3","http://click.linksynergy.com/fs-bin/click?id=V8uMkWlCTes&offerid=162746&type=3&subid=0","Hold","Barry King","President","North Carolina","Winston Salem","115 Winfield Ridge Dr ","27103","US","704 817 0549","barry@beautorium.com","10.00% commission on all goods","3.4","% of Sale","2013"," 16-APR-15","60","90","N","N/A","10.00% commission on all goods","3.4","% of Sale"," 16-APR-15","60","90","N",
"{*}BlazeVideo Inc","http://www.blazevideo.com/","38230","We are a professional multimedia solution and PC optimization software supplier. We have provided the best and most convenient programs with competitive prices in multi-languages and won a huge reputation among users all over the world since 2002. ","http://cli.linksynergy.com/cli/publisher/common/agreement.php?file=agreement.txt","http://cli.linksynergy.com/cli/publisher/programs/advertiser_detail.php?mid=38230&nid=1&offerhistory=1&controls=1:1:3","http://click.linksynergy.com/fs-bin/click?id=V8uMkWlCTes&offerid=292425&type=3&subid=0","Hold","Helen","affiliate manager","Guangdong","Shenzhen","Room 1507, East Tower Building, ","518057","CN","86-18930396906","affiliate@blazevideo.com","private |50.00%-80.00% commission on all goods","4.1","% of Sale","2013"," 06-JUN-15","30","90","N","N/A","40.00%-60.00% commission on all goods","8.2","% of Sale"," 17-NOV-15","90","90","N",
"{*}Candy Galaxy","http://www.candygalaxy.com/","37345","Candy Galaxy is an online candy store that is passionate about bringing you the candy that you love. We have an expansive candy selection all the way from Milky Ways to Mars. ","http://cli.linksynergy.com/cli/publisher/common/agreement.php?file=37345_20120119_210420.txt","http://cli.linksynergy.com/cli/publisher/programs/advertiser_detail.php?mid=37345&nid=1&offerhistory=1&controls=1:1:3","http://click.linksynergy.com/fs-bin/click?id=V8uMkWlCTes&offerid=246814&type=3&subid=0","Hold","Roger Snow","Lead Affiliate Manager","Tennessee","nashville","609 lafayette street ","37203","US","1.877.448.7255","candygalaxy@snow-consulting.com","7.00%-10.00% commission on all goods","6.1","% of Sale","2013"," 15-DEC-15","24","90","N","N/A","7.00%-10.00% commission on all goods","6.1","% of Sale"," 15-DEC-15","24","90","N",
"{*}Cargo Cosmetics","www.Cargocosmetics.com","39024","Cargo creates products that are fresh, innovative and fun. At Cargo, we truly believe that the journey is just as important as the destination. Therefore we will always strive to deliver ""makeup to move you."" Happy travels!","http://cli.linksynergy.com/cli/publisher/common/agreement.php?file=agreement.txt","http://cli.linksynergy.com/cli/publisher/programs/advertiser_detail.php?mid=39024&nid=1&offerhistory=1&controls=1:1:3","http://click.linksynergy.com/fs-bin/click?id=V8uMkWlCTes&offerid=313952&type=3&subid=0","Hold","Jessica LaRocco","Affiliate Marketing Manager","New York","New York","950 Third Avenue, 3rd Floor ","10022","US","678.845.6575","jlarocco@tprholdings.com","18.00% commission on all goods","2.1","% of Sale","2014"," 15-NOV-15","45","90","N","N/A","18.00% commission on all goods","2.1","% of Sale"," 15-NOV-15","45","90","N",
"{*}Carlos by Carlos Santana","http://www.carlosshoes.com/","38508","CarlosShoes.com is the official site for Carlos by Carlos Santana Shoes.  These are hip, hot fashionable shoes inspired by the passion and energy that surround Santana's music. ","http://cli.linksynergy.com/cli/publisher/common/agreement.php?file=38508_294545_2.txt","http://cli.linksynergy.com/cli/publisher/programs/advertiser_detail.php?mid=38508&nid=1&offerhistory=1&controls=1:1:3","http://click.linksynergy.com/fs-bin/click?id=V8uMkWlCTes&offerid=294545&type=3&subid=0","Hold","Erin Buehler","Affiliate Marketing Specialist","Missouri","St. Louis","8300 Maryland Ave. ","63105","US","3148543640","ebuehler@brownshoe.com","10.00% commission on all goods","3.2","% of Sale","2014"," 16-MAY-15","90","90","N","N/A","10.00% commission on all goods","3.2","% of Sale"," 16-MAY-15","90","90","N",
"{*}CircuitCity","http://www.circuitcity.com","36922","The New CircuitCity.com web site offers a wider selection of products than previously offered in Circuit City stores. You'll find an expanded selection of consumer electronics, desktops, notebooks, netbooks, and all the accessories to go with them.","http://cli.linksynergy.com/cli/publisher/common/agreement.php?file=36922_230598.txt","http://cli.linksynergy.com/cli/publisher/programs/advertiser_detail.php?mid=36922&nid=1&offerhistory=1&controls=1:1:3","http://click.linksynergy.com/fs-bin/click?id=V8uMkWlCTes&offerid=230598&type=3&subid=0","Hold","Bill Brown","Affiliate Marketing Manager","Florida","Miami","7795 W Flagler Street ","33144","US","305-415-2313","william.brown@syx.com","private |4.00% commission on all goods; [private |3.00% commission on selected goods,; private |4.00% commission on selected goods,; private |5.00% commission on selected goods,; private |5.00% commission on selected goods,; private |10.00% commission on selected goods,; private |10.00% commission on selected goods,; private |10.00% commission on selected goods]; ","19.768","% of Sale","2012"," 21-DEC-15","14","90","N","N/A","private |4.00% commission on all goods; [private |3.00% commission on selected goods,; private |4.00% commission on selected goods,; private |5.00% commission on selected goods,; private |5.00% commission on selected goods,; private |10.00% commission on selected goods,; private |10.00% commission on selected goods,; private |10.00% commission on selected goods]; ","19.768","% of Sale"," 21-DEC-15","14","90","N",
"{*}Clearance.bestbuy.com","https://clearance.bestbuy.com/","38851","Best Buy Computing Clearance gives you great prices on brand name refurbished and clearance computing devices ? and most of our products come with a warranty.","http://cli.linksynergy.com/cli/publisher/common/agreement.php?file=38851_310617_17.txt","http://cli.linksynergy.com/cli/publisher/programs/advertiser_detail.php?mid=38851&nid=1&offerhistory=1&controls=1:1:3","http://click.linksynergy.com/fs-bin/click?id=V8uMkWlCTes&offerid=310617&type=3&subid=0","Hold","Best Buy Affiliate Team","","N",""," ","","","","Ls-bestbuy@linkshare.com","1.70% commission on all goods; [1.70% commission on selected goods,; 1.70% commission on selected goods,; 2.50% commission on selected goods,; 3.00% commission on selected goods,; 4.00% commission on selected goods,; 3.00% commission on selected goods]; ","3.57","% of Sale","2014"," 26-OCT-15","45","90","N","N/A","1.70% commission on all goods; [1.70% commission on selected goods,; 1.70% commission on selected goods,; 2.50% commission on selected goods,; 3.00% commission on selected goods,; 4.00% commission on selected goods,; 3.00% commission on selected goods]; ","3.57","% of Sale"," 26-OCT-15","45","90","N",
"{*}DiamondStuds4Less","http://diamondstuds4less.com/","38792","Fine Diamond Studs and Earrings at Exceptional Prices","http://cli.linksynergy.com/cli/publisher/common/agreement.php?file=agreement.txt","http://cli.linksynergy.com/cli/publisher/programs/advertiser_detail.php?mid=38792&nid=1&offerhistory=1&controls=1:1:3","http://click.linksynergy.com/fs-bin/click?id=V8uMkWlCTes&offerid=306202&type=3&subid=0","Hold","Jason Loos","Account Manager","Texas","New Braunfels","301 Main Plaza Suite 120","78130","US","(512) 965-0224","jdlsll@sbcglobal.net","private |7.00% commission on all goods","5.1","% of Sale","2013"," 19-SEP-15","30","90","N","N/A","7.00% commission on all goods","3.1","% of Sale"," 15-AUG-15","30","90","N",
"{*}Discount School Supply","http://www.discountschoolsupply.com/?domainredirect=true&","38866","Discount School Supply-School Supplies, Arts & Crafts At Discount Prices!","http://cli.linksynergy.com/cli/publisher/common/agreement.php?file=agreement.txt","http://cli.linksynergy.com/cli/publisher/programs/advertiser_detail.php?mid=38866&nid=1&offerhistory=1&controls=1:1:3","http://click.linksynergy.com/fs-bin/click?id=V8uMkWlCTes&offerid=306332&type=3&subid=0","Hold","Kent Heltne","VP of Sales","Arizona","Scottsdale","13118 N. 145th Way ","85259","US","480-659-7874","kenth@eaccountable.com","private |5.00% commission on all goods","5.1","% of Sale","2013"," 31-DEC-18","30","90","N","N/A","5.00% commission on all goods","4.1","% of Sale"," 31-DEC-18","30","90","N",
"{*}Double Inks","http://doubleinks.com/","38696","This well branded name offers customers high quality low cost ink and toner supplies. At DoubleInks.com customers can shop for HP, Epson, Brother, Lexmark, Canon, and many more alternative replacement cartridges. 
","http://cli.linksynergy.com/cli/publisher/common/agreement.php?file=38696_312194.txt","http://cli.linksynergy.com/cli/publisher/programs/advertiser_detail.php?mid=38696&nid=1&offerhistory=1&controls=1:1:3","http://click.linksynergy.com/fs-bin/click?id=V8uMkWlCTes&offerid=312194&type=3&subid=0","Hold","Armen Issaghoulia","Affiliate Manager","California","Montrose","2654 Honolulu Ave Suite A ","91020","US","818.957.7114 x101","armen@doubleinks.com","23.00% commission on all goods","6.1","% of Sale","2013"," 31-DEC-18","10","90","N","N/A","private |23.00% commission on all goods","7.1","% of Sale"," 05-AUG-15","10","90","N",
"{*}DrScholls","http://www.drschollsshoes.com/","38503","DrSchollsShoes.com is inspired by natural beauty that is timeless and relaxed. We love effortless style no matter the season, the authentic heritage of American design, and fashion that's simple, yet full of surprises. ","http://cli.linksynergy.com/cli/publisher/common/agreement.php?file=38503_294534_3.txt","http://cli.linksynergy.com/cli/publisher/programs/advertiser_detail.php?mid=38503&nid=1&offerhistory=1&controls=1:1:3","http://click.linksynergy.com/fs-bin/click?id=V8uMkWlCTes&offerid=294534&type=3&subid=0","Hold","Erin Buehler","Affiliate Marketing Specialist","Missouri","St. Louis","8300 Maryland Ave. ","63105","US","3148543640","ebuehler@brownshoe.com","10.00% commission on all goods","3.3","% of Sale","2014"," 16-MAY-15","90","90","N","N/A","10.00% commission on all goods","3.3","% of Sale"," 16-MAY-15","90","90","N",
"{*}Ebay.bbymsolutions.com","https://ebay.bbymsolutions.com/","38853","We make buying a new phone fun and simple. Shop the latest phones and plans from today's top carriers - including Verizon Wireless, T-Mobile, Sprint, and AT&T - all in one place. ","http://cli.linksynergy.com/cli/publisher/common/agreement.php?file=38853_20130920_150011.txt","http://cli.linksynergy.com/cli/publisher/programs/advertiser_detail.php?mid=38853&nid=1&offerhistory=1&controls=1:1:3","http://click.linksynergy.com/fs-bin/click?id=V8uMkWlCTes&offerid=332466&type=3&subid=0","Hold","","","N",""," ","","","","","0.00% commission on all goods; [0.00% commission on selected goods,; $25.00 flat fee on selected goods]; ","12.2","% of Sale","2014"," 16-APR-15","3","90","N","N/A","0.00% commission on all goods; [0.00% commission on selected goods,; $25.00 flat fee on selected goods]; ","12.2","% of Sale"," 16-APR-15","3","90","N",
"{*}Economist GMAT Tutor","http://gmat.economist.com/","38958","The Economist GMAT Tutor offers a tiered commission structure:
$5 for Trials
15% for monthly orders totaling $2500 or under
18% commission for orders totaling over $2500","http://cli.linksynergy.com/cli/publisher/common/agreement.php?file=38958_20131029_211344.txt","http://cli.linksynergy.com/cli/publisher/programs/advertiser_detail.php?mid=38958&nid=1&offerhistory=1&controls=1:1:3","http://click.linksynergy.com/fs-bin/click?id=V8uMkWlCTes&offerid=316073&type=3&subid=0","Hold","Elizabeth Alexander","Marketing Executive","New York","New York","The Economist 750 Third Avenue","10017","US","212 554-0649","elizabethalexander@economist.com","15.00%-18.00% commission on all goods","7.1","% of Sale","2014"," 15-SEP-15","30","90","N","N/A","15.00%-18.00% commission on all goods","7.1","% of Sale"," 15-SEP-15","30","90","N",
"{*}Emilie M","http://www.emiliemshop.com/","38077","Emilie M. is an online brand of beautifully designed handbags and accessories. With our blog, style guides, and exciting new products, customers are sure to have an enjoyable shopping experience every time they visit the site!","http://cli.linksynergy.com/cli/publisher/common/agreement.php?file=38077_279497_2.txt","http://cli.linksynergy.com/cli/publisher/programs/advertiser_detail.php?mid=38077&nid=1&offerhistory=1&controls=1:1:3","http://click.linksynergy.com/fs-bin/click?id=V8uMkWlCTes&offerid=279497&type=3&subid=0","Hold","Yocheved Schlachter","Affiliate Account Manager","New York","Brooklyn","20 Jay St ","11201","US","646-290-8127","emiliemaff@bluecherrygroup.com","10.00% commission on all goods","4.2","% of Sale","2013"," 04-JUN-16","30","90","N","N/A","10.00% commission on all goods","4.2","% of Sale"," 04-JUN-16","30","90","N",
"{*}EssayEdge.com","http://www.cunet.com/","39080","EssayEdge is the one source for admissions essay editing and a one-stop shop for applicants seeking to make their essays the best they can be. l. ","http://cli.linksynergy.com/cli/publisher/common/agreement.php?file=agreement.txt","http://cli.linksynergy.com/cli/publisher/programs/advertiser_detail.php?mid=39080&nid=1&offerhistory=1&controls=1:1:3","http://click.linksynergy.com/fs-bin/click?id=V8uMkWlCTes&offerid=327619&type=3&subid=0","Hold","Laurie Motyka","Media Supervisior","New Jersey","Paramus","461 From Road ","07652","US","2014777856","Laurie.Motyka@cunet.com","10.00%-12.00% commission on all goods","8.1","% of Sale","2014"," 15-SEP-15","60","90","N","N/A","10.00%-12.00% commission on all goods","8.1","% of Sale"," 15-SEP-15","60","90","N",
"{*}Ezy Dog","http://ezydog.com/","37911","EzyDog makes a line of products encompassing the rugged outdoor lifestyle dogs love, along with the comfort and style pet owners prefer. All EzyDog products are designed to help both owners and pets get more out of the great outdoors.","http://cli.linksynergy.com/cli/publisher/common/agreement.php?file=agreement.txt","http://cli.linksynergy.com/cli/publisher/programs/advertiser_detail.php?mid=37911&nid=1&offerhistory=1&controls=1:1:3","http://click.linksynergy.com/fs-bin/click?id=V8uMkWlCTes&offerid=267729&type=3&subid=0","Hold","Alisa Gavrylyuk","Affiliate Manager","Idaho","Sandpoint","PO BOX 99 ","83864","US","2082633181","Alisa@versamarketinginc.com","9.00% commission on all goods","3.1","% of Sale","2013"," 15-DEC-15","120","90","N","N/A","9.00% commission on all goods","3.1","% of Sale"," 15-DEC-15","120","90","N",
"{*}Fergie Footwear","http://www.fergieshoes.com/","38506","FergieShoes.com strives to capture the essence of the Grammy award-winning superstar with unabashedly sexy, indulgent footwear that caters to fashion-forward women. Whatever the occasion, you?ll always feel glamorous in Fergie shoes, boots and sandals. ","http://cli.linksynergy.com/cli/publisher/common/agreement.php?file=38506_294542_2.txt","http://cli.linksynergy.com/cli/publisher/programs/advertiser_detail.php?mid=38506&nid=1&offerhistory=1&controls=1:1:3","http://click.linksynergy.com/fs-bin/click?id=V8uMkWlCTes&offerid=294542&type=3&subid=0","Hold","Erin Buehler","Affiliate Marketing Specialist","Missouri","St. Louis","8300 Maryland Ave. ","63105","US","3148543640","ebuehler@brownshoe.com","10.00% commission on all goods","5.2","% of Sale","2014"," 16-MAY-15","90","90","N","N/A","10.00% commission on all goods","5.2","% of Sale"," 16-MAY-15","90","90","N",
"{*}Funsational","http://www.funsational.com/","37526","Providing printable party games for over 10 years an have over 500 products available! Our great collection of printable party games are perfect for holiday parties, classroom use, baby and bridal showers, or for a bit of everyday fun.","http://cli.linksynergy.com/cli/publisher/common/agreement.php?file=37526_20120504_210028.txt","http://cli.linksynergy.com/cli/publisher/programs/advertiser_detail.php?mid=37526&nid=1&offerhistory=1&controls=1:1:3","http://click.linksynergy.com/fs-bin/click?id=V8uMkWlCTes&offerid=353309&type=3&subid=0","Hold","Danielle Dougherty","Affiliate Manager","Idaho","Coeur d' Alene","610 W. Hubbard St. Suite 125 & 126","83814","US","800-208-6215 ext 107","affiliates@funsational.com","15.00% commission on all goods; [30.00% commission on selected goods]; ","19.2","% of Sale","2013"," 16-MAY-15","90","90","N","N/A","15.00% commission on all goods; [30.00% commission on selected goods]; ","19.2","% of Sale"," 16-MAY-15","90","90","N",
"{*}Giorgio Brutini","https://www.giorgiobrutini.com/","39062","Giorgio Brutini is a modern mens footwear brand that delivers an edge of irreverence for the confident man. Featured in Esquire, I Am Galla, Haute Look, Gilt Man, and Dappered. Outspoken, in style.","http://cli.linksynergy.com/cli/publisher/common/agreement.php?file=39062_20131127_211320.txt","http://cli.linksynergy.com/cli/publisher/programs/advertiser_detail.php?mid=39062&nid=1&offerhistory=1&controls=1:1:3","http://click.linksynergy.com/fs-bin/click?id=V8uMkWlCTes&offerid=315796&type=3&subid=0","Hold","Gabriel Marcial","Digital Strategist","New York","Brooklyn","9 St Johns Place ","11217","US","2012493980","gabe@ninelinesconsulting.com","11.00% commission on all goods","3.1","% of Sale","2014"," 02-DEC-15","10","90","N","N/A","11.00% commission on all goods","3.1","% of Sale"," 02-DEC-15","10","90","N",
"{*}Global Rebels","http://globalrebels.com/","38682","Global Rebels

Global Rebels Inc. produces and provides the most stylish and trendy Rock Star gear on the Internet.

Founded in 2006 by legendary designer Christopher Wicks, Global Rebels established itself by offering fashions with style and flair.
","http://cli.linksynergy.com/cli/publisher/common/agreement.php?file=agreement.txt","http://cli.linksynergy.com/cli/publisher/programs/advertiser_detail.php?mid=38682&nid=1&offerhistory=1&controls=1:1:3","http://click.linksynergy.com/fs-bin/click?id=V8uMkWlCTes&offerid=298548&type=3&subid=0","Hold","Andy Spears","Afiliate Marketing Manager","Tennessee","Memphis","8000 Centerview Parkway Suite 203","38018","US","(901) 672-7243","affiliate@globalrebels.com","5.00% commission on all goods","4.1","% of Sale","2014"," 12-JUL-15","10","90","N","N/A","5.00% commission on all goods","4.1","% of Sale"," 12-JUL-15","10","90","N",
"{*}Grafic","http://www.grafic.com/","38512","Grafic is a cutting-edge retailer founded in 2003 just north of Toronto. Curated for the modern, fashion forward individual, Grafic offers a complete collection of designer apparel and accessories.","http://cli.linksynergy.com/cli/publisher/common/agreement.php?file=38512_20130607_000729.txt","http://cli.linksynergy.com/cli/publisher/programs/advertiser_detail.php?mid=38512&nid=1&offerhistory=1&controls=1:1:3","http://click.linksynergy.com/fs-bin/click?id=V8uMkWlCTes&offerid=294307&type=3&subid=0","Hold","Affiliate Manager","Affiliate Manager","California","Santa Cruz","2125 Delaware Avenue Suite E","95060","US","831-464-1441","grafic@affiliatetraction.ca","6.00% commission on all goods","3.1","% of Sale","2014"," 11-JUN-15","30","90","N","N/A","6.00% commission on all goods","3.1","% of Sale"," 11-JUN-15","30","90","N",
