"RingCentral","http://www.ringcentral.com","35849","RingCentral is the industry-leading provider of hosted phone and fax services for small businesses and entrepreneurs, allowing businesses worldwide to increase their sales by projecting a more professional image and attracting new customers.","http://cli.linksynergy.com/cli/publisher/common/agreement.php?file=agreement.txt","http://cli.linksynergy.com/cli/publisher/programs/advertiser_detail.php?mid=35849&nid=1&offerhistory=1&controls=1:1:3","http://click.linksynergy.com/fs-bin/click?id=V8uMkWlCTes&offerid=335092&type=3&subid=0","Active","Ryan Macapagal","Affiliate Marketing Manager","California","San Mateo","1400 Fashion Island Blvd., 7th Floor","94404","US","6504724046","lsaffiliates@ringcentral.com","private |$15.00 flat fee on selected goods; [private |$30.00-40.00 flat fee on selected goods,; private |$30.00-40.00 flat fee on selected goods,; private |$12.00 flat fee on selected goods,; private |$20.00-30.00 flat fee on selected goods,; private |$20.00-30.00 flat fee on selected goods,; private |$50.00 flat fee on selected goods,; private |$50.00 flat fee on selected goods,; private |$100.00 flat fee on selected goods,; private |$200.00 flat fee on selected goods,; private |$350.00 flat fee on selected goods,; private |$500.00 flat fee on selected goods,; private |$700.00 flat fee on selected goods,; private |$1,000.00 flat fee on selected goods,; private |$1,200.00 flat fee on selected goods,; private |$50.00 flat fee on selected goods,; private |$100.00 flat fee on selected goods,; private |$200.00 flat fee on selected goods,; private |$350.00 flat fee on selected goods,; private |$500.00 flat fee on selected goods,; private |$700.00 flat fee on selected goods,; private |$1,000.00 flat fee on selected goods,; private |$1,200.00 flat fee on selected goods,; private |$100.00 flat fee on selected goods,; private |$200.00 flat fee on selected goods,; private |$350.00 flat fee on selected goods,; private |$500.00 flat fee on selected goods,; private |$700.00 flat fee on selected goods,; private |$1,000.00 flat fee on selected goods,; private |$1,200.00 flat fee on selected goods,; private |$2,000.00 flat fee on selected goods,; private |$2,000.00 flat fee on selected goods,; private |$2,000.00 flat fee on selected goods,; private |$15.00 flat fee on selected goods,; private |$20.00 flat fee on selected goods,; private |$25.00 flat fee on selected goods,; private |$50.00 flat fee on selected goods]; ","262.1","Flat Fee","2014"," 01-JAN-19","90","90","N","N/A","$15.00 flat fee on selected goods; [$30.00-40.00 flat fee on selected goods,; $30.00-40.00 flat fee on selected goods,; $12.00 flat fee on selected goods,; $20.00-30.00 flat fee on selected goods,; $20.00-30.00 flat fee on selected goods,; $50.00 flat fee on selected goods,; $50.00 flat fee on selected goods,; $100.00 flat fee on selected goods,; $200.00 flat fee on selected goods,; $350.00 flat fee on selected goods,; $500.00 flat fee on selected goods,; $700.00 flat fee on selected goods,; $1,000.00 flat fee on selected goods,; $1,200.00 flat fee on selected goods,; $50.00 flat fee on selected goods,; $100.00 flat fee on selected goods,; $200.00 flat fee on selected goods,; $350.00 flat fee on selected goods,; $500.00 flat fee on selected goods,; $700.00 flat fee on selected goods,; $1,000.00 flat fee on selected goods,; $1,200.00 flat fee on selected goods,; $100.00 flat fee on selected goods,; $200.00 flat fee on selected goods,; $350.00 flat fee on selected goods,; $500.00 flat fee on selected goods,; $700.00 flat fee on selected goods,; $1,000.00 flat fee on selected goods,; $1,200.00 flat fee on selected goods,; $2,000.00 flat fee on selected goods,; $2,000.00 flat fee on selected goods,; $2,000.00 flat fee on selected goods,; $15.00 flat fee on selected goods,; $20.00 flat fee on selected goods,; $25.00 flat fee on selected goods,; $50.00 flat fee on selected goods]; ","225.2","Flat Fee"," 15-APR-19","90","90","N",
"Royal Albert","http://www.royalalbert.com/","39064","Royal Albert has been dedicated to English grace, elegance, & romance since Victorian times.  Quintessentially English, Royal Albert Gifts, Fine China & Tableware are both traditional & avant-garde. Join in & begin promoting through our exclusive program!","http://cli.linksynergy.com/cli/publisher/common/agreement.php?file=39064_337712.txt","http://cli.linksynergy.com/cli/publisher/programs/advertiser_detail.php?mid=39064&nid=1&offerhistory=1&controls=1:1:3","http://click.linksynergy.com/fs-bin/click?id=V8uMkWlCTes&offerid=337712&type=3&subid=0","Active","Scott Wanamaker","Account Manager","Colorado","Denver","1675 Larimer Street ","80202","US","866 209 0669","royalalbert@eaccountable.com","6.00% commission on all goods","3.1","% of Sale","2014"," 31-DEC-19","30","90","N","N/A","6.00% commission on all goods","3.1","% of Sale"," 31-DEC-19","30","90","N",
"Royal Doulton","http://www.royaldoulton.com","39067","One of the world's foremost brands, Royal Doulton produces a wide range of product from tableware & stemware to collectables & gifts. Royaldoulton.com offers 100's of classic & contemporary products relevant to the lifestyle of today's consumers.","http://cli.linksynergy.com/cli/publisher/common/agreement.php?file=39067_337728.txt","http://cli.linksynergy.com/cli/publisher/programs/advertiser_detail.php?mid=39067&nid=1&offerhistory=1&controls=1:1:3","http://click.linksynergy.com/fs-bin/click?id=V8uMkWlCTes&offerid=337728&type=3&subid=0","Active","Scott Wanamaker","Account Manager","Colorado","Denver","1675 Larimer Street ","80202","US","8662090669","royaldoulton@eaccountable.com","6.00% commission on all goods","5.1","% of Sale","2014"," 16-DEC-19","30","90","N","N/A","6.00% commission on all goods","5.1","% of Sale"," 16-DEC-19","30","90","N",
"SMS Audio LLC","www.smsaudio.com","37450","A first-class audio headphone and accessories brand, SMS Audio, LLC is dedicated to improving the way people experience music. SMS Audio combines technology, function and style to bring the highest caliber of sound, comfort and fashion to every product.","http://cli.linksynergy.com/cli/publisher/common/agreement.php?file=37450_20120409_210552.txt","http://cli.linksynergy.com/cli/publisher/programs/advertiser_detail.php?mid=37450&nid=1&offerhistory=1&controls=1:1:3","http://click.linksynergy.com/fs-bin/click?id=V8uMkWlCTes&offerid=254721&type=3&subid=0","Active","Max Zambrano","Director, Digital Marketing","Florida","Delray Beach","2885 South Congress Ave STE D","33445","US","5612782323","mzambrano@smsaudio.com","private |20.00% commission on selected goods; [private |15.00% commission on selected goods]; ","8.3","% of Sale","2012"," 24-MAY-15","30","90","N","N/A","20.00% commission on selected goods; [15.00% commission on selected goods]; ","6.6","% of Sale"," 24-MAY-15","30","90","N",
"Sam's Club","http://www.samsclub.com/sams/homepage.jsp","38733","SamsClub.com is in business for our members and small businesses with exclusive savings on the things they need, the things they love, and on all sorts of unexpected things.","http://cli.linksynergy.com/cli/publisher/common/agreement.php?file=38733_20130815_221413.txt","http://cli.linksynergy.com/cli/publisher/programs/advertiser_detail.php?mid=38733&nid=1&offerhistory=1&controls=1:1:3","http://click.linksynergy.com/fs-bin/click?id=V8uMkWlCTes&offerid=371325&type=3&subid=0","Active","Kim Idom","Digital Marketing Manager","Arkansas","Bentonville","2101 SE Simple Savings Dr. ","72716-0745","US","479-277-8261","samsclubaffiliates@samsclub.com","4.00% commission on all goods; [1.00% commission on selected goods,; 7.00% commission on selected goods,; 0.00% commission on selected goods]; ","181.5","% of Sale","2014"," 26-FEB-16","14","90","N","N/A","4.00% commission on all goods; [1.00% commission on selected goods,; 7.00% commission on selected goods,; 0.00% commission on selected goods]; ","181.5","% of Sale"," 26-FEB-16","14","90","N",
"SammyDress.com","http://www.sammydress.com/","38491","We are a leading B2C fashion wholesaler in Asia. We are professional in selling high-qualified and low-priced fashion products. We are one of the biggest inexpensive online fashion stores.","http://cli.linksynergy.com/cli/publisher/common/agreement.php?file=agreement.txt","http://cli.linksynergy.com/cli/publisher/programs/advertiser_detail.php?mid=38491&nid=1&offerhistory=1&controls=1:1:3","http://click.linksynergy.com/fs-bin/click?id=V8uMkWlCTes&offerid=347736&type=3&subid=0","Active","Nicole","Affiliate program leader","Guangdong","Shenzhen","Shenzhen China Chuangye Road Shenzhen China","518000","CN","8613410317632","affiliate@sammydress.com","private |12.00% commission on all goods","12.1","% of Sale","2014"," 31-DEC-15","10","90","N","N/A","8.00% commission on all goods","11.1","% of Sale"," 31-DEC-15","10","90","N",
"Scholastic Teacher Express","Scholastic Teacher Expres","38543","The Scholastic Teacher Express store provides a new way to shop for educational products offering PDF versions, as well as paperback versions of thousands of teaching resources books, activities, practice pages and lessons plans at everyday low prices.","http://cli.linksynergy.com/cli/publisher/common/agreement.php?file=38543_305620.txt","http://cli.linksynergy.com/cli/publisher/programs/advertiser_detail.php?mid=38543&nid=1&offerhistory=1&controls=1:1:3","http://click.linksynergy.com/fs-bin/click?id=V8uMkWlCTes&offerid=305620&type=3&subid=0","Active","Rachel Nugent","VP of Client Services","New York","New York","740 Broadway Suite 701","10003","US","212-925-6558 ext109","rachel@directagents.com","8.00% commission on all goods","3.1","% of Sale","2014"," 19-DEC-18","30","90","N","N/A","8.00% commission on all goods","3.1","% of Sale"," 19-DEC-18","30","90","N",
"SecondSpin.com","http://www.secondspin.com","14060","Largest Buyer & Seller of Used CDs, DVDs & Games","http://cli.linksynergy.com/cli/publisher/common/agreement.php?file=agreement.txt","http://cli.linksynergy.com/cli/publisher/programs/advertiser_detail.php?mid=14060&nid=1&offerhistory=1&controls=1:1:3","http://click.linksynergy.com/fs-bin/click?id=V8uMkWlCTes&offerid=310591&type=3&subid=0","Active","Affiliate Manager","Affiliate Manager","New York","Albany","2230 Carson St. ","12203","US","518-452-1242","CWohlfield@TWEC.COM","private |5.00% commission on all goods","27.1","% of Sale","2013"," 28-FEB-16","10","90","N","N/A","5.00% commission on all goods","20.1","% of Sale"," 30-AUG-15","30","90","N",
"Sephra","http://www.sephra.com/","38559"," We welcome the opportunity to work with quality Affiliates and provide an attractive commission schedule starting at 10% commission on each sale.","http://cli.linksynergy.com/cli/publisher/common/agreement.php?file=agreement.txt","http://cli.linksynergy.com/cli/publisher/programs/advertiser_detail.php?mid=38559&nid=1&offerhistory=1&controls=1:1:3","http://click.linksynergy.com/fs-bin/click?id=V8uMkWlCTes&offerid=305388&type=3&subid=0","Active","Chaitanya","Affiliate Manager","California","San Diego","11035 Technology Place, Ste 100 ","92127","US","(858) 675 3088","affiliatemanager@affiliate.sephra.com","10.00%-12.00% commission on all goods","4.1","% of Sale","2014"," 21-AUG-15","45","90","N","N/A","10.00%-12.00% commission on all goods","4.1","% of Sale"," 21-AUG-15","45","90","N",
"ServerMania","http://www.servermania.com/","40200","At Server Mania we provide our customers with cutting-edge technology, backed by superior customer service and unbeatable reliability. All of our Cloud, VPS, Dedicated, and Web Hosting solutions are backed by a powerful Surge platform. ","http://cli.linksynergy.com/cli/publisher/common/agreement.php?file=40200_371933.txt","http://cli.linksynergy.com/cli/publisher/programs/advertiser_detail.php?mid=40200&nid=1&offerhistory=1&controls=1:1:3","http://click.linksynergy.com/fs-bin/click?id=V8uMkWlCTes&offerid=371933&type=3&subid=0","Active","Amy Harrin","Affiliate Manager","Ontario","Toronto","371 Front Street West ","M5V 3S8","CA","1-888-237-6637","amy@servermania.com","private |80.00% commission on all goods","4.1","% of Sale","2015"," 03-MAR-20","90","90","N","N/A","80.00% commission on all goods","3.1","% of Sale"," 24-FEB-20","90","90","N",
"ShareTrips","https://sharetrips.com/","39123","ShareTrips is a screen sharing travel website where you and your travel companions interact and view search results simultaneously and in real time. Also get Up to 5%* Cash Back on your completed hotel stay with Share & Save on ShareTrips. ","http://cli.linksynergy.com/cli/publisher/common/agreement.php?file=39123_321905.txt","http://cli.linksynergy.com/cli/publisher/programs/advertiser_detail.php?mid=39123&nid=1&offerhistory=1&controls=1:1:3","http://click.linksynergy.com/fs-bin/click?id=V8uMkWlCTes&offerid=321905&type=3&subid=0","Active","Josh Skoko","CMO","California","Gilroy","711 Eschenburg Dr. ","95020","US","4158469006","jskoko@sharetrips.com","private |0.00% commission on selected goods; [private |5.50% commission on selected goods]; ","5.1","% of Sale","2014"," 02-DEC-15","14","90","N","N/A","0.00% commission on selected goods; [5.50% commission on selected goods]; ","3.1","% of Sale"," 01-JAN-19","14","90","N",
"Shoebuy.com","http://www.shoebuy.com/","38891","Shoebuy.com is the world's largest site for shoes. We offer free shipping and free returns on over 1,200 top brands and 1,000,000 of the latest footwear, apparel, handbags, luggage, accessories and more!","http://cli.linksynergy.com/cli/publisher/common/agreement.php?file=38891_321325.txt","http://cli.linksynergy.com/cli/publisher/programs/advertiser_detail.php?mid=38891&nid=1&offerhistory=1&controls=1:1:3","http://click.linksynergy.com/fs-bin/click?id=V8uMkWlCTes&offerid=321325&type=3&subid=0","Active","Colleen Tobin","Affiliate Marketing Manager","Massachusetts","Boston","101 Arch Street, 16th Floor ","02110","US","617-451-2929 x 254","colleen.tobin@shoebuy.com","12.00% commission on all goods","33.1","% of Sale","2014"," 01-FEB-18","30","90","N","N/A","12.00% commission on all goods","33.1","% of Sale"," 01-FEB-18","30","90","N",
"Shoes.com","http://www.shoes.com/","38501","Shoes.com is an online shoe retailer featuring more than 400 of the best shoe brands with the latest styles for men, women & kids. We offer 24-hour non-stop shoe shopping with free shipping & easy returns in the US and international shipping is available.","http://cli.linksynergy.com/cli/publisher/common/agreement.php?file=38501_324566_4.txt","http://cli.linksynergy.com/cli/publisher/programs/advertiser_detail.php?mid=38501&nid=1&offerhistory=1&controls=1:1:3","http://click.linksynergy.com/fs-bin/click?id=V8uMkWlCTes&offerid=324566&type=3&subid=0","Active","Travis Godbout","President ? Propellant CG","Washington","Seattle","1730 Minor Avenue Suite 700","98101","US","206-369-4405","travis@propellantcg.com","6.00% commission on all goods","97.4","% of Sale","2014"," 04-MAR-16","90","90","N","N/A","6.00% commission on all goods","97.4","% of Sale"," 04-MAR-16","90","90","N",
"Smartfares","http://www.smartfares.com","38656","SmartFares is an online travel reservations service that specializes in cheap flights and discounted airline tickets to the top travel destinations within the United States and the World.","http://cli.linksynergy.com/cli/publisher/common/agreement.php?file=agreement.txt","http://cli.linksynergy.com/cli/publisher/programs/advertiser_detail.php?mid=38656&nid=1&offerhistory=1&controls=1:1:3","http://click.linksynergy.com/fs-bin/click?id=V8uMkWlCTes&offerid=299341&type=3&subid=0","Active","Bhaumik Sharma","Manager Affiliate Marketing","California","San Diego","4545 Murphy Canyon Road Suite 210","92123","US","8584297599","affiliates@smartfares.com","$9.00-11.00 flat fee on selected goods; [$6.00-8.00 flat fee on selected goods,; $3.00-5.00 flat fee on selected goods]; ","6.4","Flat Fee","2014"," 31-DEC-16","90","90","N","N/A","$9.00-11.00 flat fee on selected goods; [$6.00-8.00 flat fee on selected goods,; $3.00-5.00 flat fee on selected goods]; ","6.4","Flat Fee"," 31-DEC-16","90","90","N",
"Smyth Jewelers","http://www.smythjewelers.com/","38846","Smyth Jewelers is the East coast's largest jewelry store. Smyth offers quality jewelry and gifts. We offer a 100 Day / 100% Satisfaction Guarantee. All orders over $200, ship free!","http://cli.linksynergy.com/cli/publisher/common/agreement.php?file=agreement.txt","http://cli.linksynergy.com/cli/publisher/programs/advertiser_detail.php?mid=38846&nid=1&offerhistory=1&controls=1:1:3","http://click.linksynergy.com/fs-bin/click?id=V8uMkWlCTes&offerid=310598&type=3&subid=0","Active","Jean Flors","Digital Manager","Maryland","Timonium","2020 York Road ","21093","US","410-337-0066","jflors@tbc.us","private |4.00% commission on all goods","4.1","% of Sale","2013"," 31-DEC-18","60","90","N","N/A","4.00% commission on all goods","3.1","% of Sale"," 18-OCT-18","60","90","N",
"SodaStream (Soda-Club) USA","http://www.sodastreamusa.com","13943","The largest company for home carbonation systems. Over 8 million users worldwide. Turn tap water into sparkling water in seconds. A great opportunity for high conversions; Used by families, environmentalists, individuals, businesses and boaters.","http://cli.linksynergy.com/cli/publisher/common/agreement.php?file=agreement.txt","http://cli.linksynergy.com/cli/publisher/programs/advertiser_detail.php?mid=13943&nid=1&offerhistory=1&controls=1:1:3","http://click.linksynergy.com/fs-bin/click?id=V8uMkWlCTes&offerid=101418&type=3&subid=0","Active","Steven Rivera","Marketing Specialist","New Jersey","Mt. Laurel","200 East Park Drive Suite 600","08054","US","856-755-3400","stevenr@sodastream.com","5.00% commission on all goods; [10.00% commission on selected goods,; 5.00% commission on selected goods]; ","12.9","% of Sale","2014"," 11-NOV-22","45","90","N","N/A","5.00% commission on all goods; [10.00% commission on selected goods,; 5.00% commission on selected goods]; ","12.9","% of Sale"," 11-NOV-22","45","90","N",
"Spartan Race","http://www.spartan.com/","39471","The Spartan Race Affiliate Program offers commissions of $8 per U.S. race registration & a 45 day cookie. Reebok Spartan Race offers local races all year round for teams,  individuals, and kids ranging from Sprint (3+ mi.) to Beast (12+ mi.) distances.","http://cli.linksynergy.com/cli/publisher/common/agreement.php?file=39471_338482_2.txt","http://cli.linksynergy.com/cli/publisher/programs/advertiser_detail.php?mid=39471&nid=1&offerhistory=1&controls=1:1:3","http://click.linksynergy.com/fs-bin/click?id=V8uMkWlCTes&offerid=338482&type=3&subid=0","Active","Schaaf-PC Affiliate Management Team","Schaaf-PC Affiliate Management Team","Texas","Austin","327 Congress Suite 300","78701","US","(888) 854-7770","spartan@schaafpc.com","private |$3.00 flat fee on all goods","8.2","Flat Fee","2014"," 31-DEC-18","45","90","N","N/A","$8.00 flat fee on all goods","6.2","Flat Fee"," 31-DEC-17","45","90","N",
"SportRx","http://www.sportrx.com/","38807","SportRx is a Southern California based company created by opticians who ride their bikes, run their races, push their jogging strollers and bomb down slopes. SportRx has been creating and innovating prescription sports glasses since 1996.","http://cli.linksynergy.com/cli/publisher/common/agreement.php?file=38807_20130926_180935.txt","http://cli.linksynergy.com/cli/publisher/programs/advertiser_detail.php?mid=38807&nid=1&offerhistory=1&controls=1:1:3","http://click.linksynergy.com/fs-bin/click?id=V8uMkWlCTes&offerid=307865&type=3&subid=0","Active","Alexandra Green","Marketing Manager","California","San Diego","5076 Santa Fe Street Suite A","92109","US","8587517412","agreen@sportrx.com","8.00% commission on all goods","3.1","% of Sale","2014"," 31-DEC-15","30","90","N","N/A","8.00% commission on all goods","3.1","% of Sale"," 31-DEC-15","30","90","N",
"Stockn'Go","http://www.stockngo.com/","37244","Stockngo.com is a one-stop online destination for thousands of discounted brand-name hair care, health care, skin care, personal care, and household products. Buy products by the case for savings of up to 80%. Never pay retail prices again!","http://cli.linksynergy.com/cli/publisher/common/agreement.php?file=37244_311782.txt","http://cli.linksynergy.com/cli/publisher/programs/advertiser_detail.php?mid=37244&nid=1&offerhistory=1&controls=1:1:3","http://click.linksynergy.com/fs-bin/click?id=V8uMkWlCTes&offerid=311782&type=3&subid=0","Active","Team SNG","Affiliate Program Manager","New York","Patchogue","414 South Service Road - Number 242 ","11772","US","877-STOCKNGO","affiliate@stockngo.com","6.00% commission on all goods; [3.00% commission on selected goods]; ","151.1","% of Sale","2013"," 10-JUN-15","30","90","N","N/A","6.00% commission on all goods; [3.00% commission on selected goods]; ","151.1","% of Sale"," 10-JUN-15","30","90","N",
"TOMS Shoes","http://www.toms.com/","38583","We are a popular and rapidly growing shoe and eyewear company guided by one simple mission. With every product you purchase, we will help someone in need. One for One. ® Join our movement and enjoy the perks in the process. ","http://cli.linksynergy.com/cli/publisher/common/agreement.php?file=38583_20140311_142522.txt","http://cli.linksynergy.com/cli/publisher/programs/advertiser_detail.php?mid=38583&nid=1&offerhistory=1&controls=1:1:3","http://click.linksynergy.com/fs-bin/click?id=V8uMkWlCTes&offerid=335040&type=3&subid=0","Active","Nicole Newton","Marketing Coordinator","California","Los Angeles","5405 Jandy Place ","90066","US","310-566-3170","ls-TOMS@linkshare.com","7.00% commission on all goods; [5.00% commission on selected goods]; ","117.2","% of Sale","2014"," 01-JAN-16","30","90","N","N/A","7.00% commission on all goods; [5.00% commission on selected goods]; ","117.2","% of Sale"," 01-JAN-16","30","90","N",
"TOMS Surprise Sale","http://www.tomssurprisesale.com","39568","TOMS Surprise Sale offers limited-time, last-chance discounts on men?s, women?s and kids? shoes, eyewear and Marketplace goods.","http://cli.linksynergy.com/cli/publisher/common/agreement.php?file=agreement.txt","http://cli.linksynergy.com/cli/publisher/programs/advertiser_detail.php?mid=39568&nid=1&offerhistory=1&controls=1:1:3","http://click.linksynergy.com/fs-bin/click?id=V8uMkWlCTes&offerid=341887&type=3&subid=0","Active","Vanessa Angulo","Account Manager","California","Los Angeles","5405 Jandy Place ","90066","US","310-566-3170","ls-TOMS@linkshare.com","3.00% commission on all goods","4.1","% of Sale","2014"," 02-JUL-16","7","90","N","N/A","3.00% commission on all goods","4.1","% of Sale"," 02-JUL-16","7","90","N",
"TaxExtension.com","www.taxextension.com","39169","TaxExtension.com offers quick and easy IRS income tax extensions for those who need more time to finish their income taxes.  In about 5 minutes, users can get up to 6 more months to finish their taxes and the IRS doesn?t even ask why ? it?s automatic!  ","http://cli.linksynergy.com/cli/publisher/common/agreement.php?file=39169_20140203_151754.txt","http://cli.linksynergy.com/cli/publisher/programs/advertiser_detail.php?mid=39169&nid=1&offerhistory=1&controls=1:1:3","http://click.linksynergy.com/fs-bin/click?id=V8uMkWlCTes&offerid=323748&type=3&subid=0","Active","Affiliate Manager","Affiliate Manager","Nevada","Las Vegas","3930 Howard Hughes Parkway, 4th Floor ","89169","US","(702) 701-9514","taxextension@mgecom.com","private |30.00% commission on all goods","5.1","% of Sale","2014"," 14-FEB-17","30","90","N","N/A","30.00% commission on all goods","4.1","% of Sale"," 10-FEB-17","30","90","N",
"Team Express Distributing LLC","www.teamexpress.com","38602","Team Express is the largest marketer of baseball, softball football, basketball, volleyball and team equipment in the US. 

We offer an 8% COMMISSION rate with a 30 Day Cookie referral period. Our average order value is approximately $135. ","http://cli.linksynergy.com/cli/publisher/common/agreement.php?file=agreement.txt","http://cli.linksynergy.com/cli/publisher/programs/advertiser_detail.php?mid=38602&nid=1&offerhistory=1&controls=1:1:3","http://click.linksynergy.com/fs-bin/click?id=V8uMkWlCTes&offerid=296072&type=3&subid=0","Active","Kelly","Affiliate Manager","Texas","San Antonio","5750 Northwest Parkway, Ste 100 ","78249","US","316-250-7686","affiliates@teamexpress.com","private |8.00% commission on all goods","4.1","% of Sale","2013"," 04-JUL-15","10","90","N","N/A","8.00% commission on all goods","3.1","% of Sale"," 05-JUL-15","10","90","N",
"Tee-Links","http://tee-links.com/","38580","Tee-links.com is the golfing destination to save money at some of the top golf courses across the country. Our members can search the site for their perfect golf tee-time or travel preference.

","http://cli.linksynergy.com/cli/publisher/common/agreement.php?file=agreement.txt","http://cli.linksynergy.com/cli/publisher/programs/advertiser_detail.php?mid=38580&nid=1&offerhistory=1&controls=1:1:3","http://click.linksynergy.com/fs-bin/click?id=V8uMkWlCTes&offerid=298465&type=3&subid=0","Active","Deb K","A","New York","New York","21 Vangard ave ","10019","US","201-798-7400","debrak@tee-links.com","$3.00-5.00 flat fee on all goods","3.1","Flat Fee","2014"," 01-OCT-15","10","90","N","N/A","$3.00-5.00 flat fee on all goods","3.1","Flat Fee"," 01-OCT-15","10","90","N",
